{
  "schema_version": "coh.elastic-esql-definition/v1",
  "source_id": "elastic-prod",
  "resources": ["securityevent"],
  "fields": [
    {"name": "event_id", "vendor_name": "event.id", "type": "string", "projectable": true, "filterable": false, "sortable": true},
    {"name": "event_timestamp", "vendor_name": "@timestamp", "type": "timestamp", "projectable": true, "filterable": true, "sortable": true},
    {"name": "source_ip", "vendor_name": "source.ip", "type": "ip", "projectable": true, "filterable": true, "sortable": false}
  ],
  "default_projection": ["event_timestamp", "event_id"],
  "stable_sort": [
    {"name": "event_timestamp", "direction": "DESC"},
    {"name": "event_id", "direction": "ASC"}
  ],
  "timestamp_field": "event_timestamp",
  "tenant_field": "",
  "source_field": "",
  "hard_maximum_rows": 1000
}
